[
  {
    "chapter": "第340話前後",
    "arc": "王位継承戦",
    "day": 0,
    "time": null,
    "location": "カキン帝国 王宮",
    "event": "壺中卵の儀",
    "participants": ["ナスビー＝ホイコーロ", "14王子全員", "8王妃全員"],
    "summary": "カキン王国の伝統儀式「壺中卵の儀」を執行。14王子それぞれに守護霊獣（念獣）が宿る。これにより継承戦が正式にスタートし、参加者は死亡以外での離脱が原則不可能となる。儀式は代々のカキン国王が伝承してきた秘儀で、念能力の存在を知らない王子にも強制的に念獣が宿る。",
    "type": "儀式",
    "duration": 5
  },
  {
    "chapter": "第358話",
    "arc": "王位継承戦",
    "day": 1,
    "time": null,
    "location": "ブラックホエール号 出港前・港",
    "event": "クラピカ乗船・念講習開催宣言",
    "participants": ["クラピカ", "オイト＝ホイコーロ", "ワブル＝ホイコーロ"],
    "summary": "クラピカが第14王子ワブルの護衛統括として乗船し、他護衛・念能力者を集めて2週間で念能力の基礎を習得させる講習会の開催を宣言する。「皇帝の時間」で習得速度を5倍にする計画も同時に提示される。",
    "type": "会合",
    "duration": 8
  },
  {
    "chapter": "第359話",
    "arc": "王位継承戦",
    "day": 1,
    "time": null,
    "location": "ブラックホエール号 出港直後",
    "event": "出港・サイールド拘束・守護霊獣の脅威判明",
    "participants": ["クラピカ", "ワブル＝ホイコーロ", "オイト＝ホイコーロ", "サイールド", "ベンジャミン私設兵"],
    "summary": "ブラックホエール号が出港。乗船直後にカキン軍（ベンジャミン側）がサイールドを拘束しワブル陣営の戦力が早期に低下する。守護霊獣が吸血・寄生型の念獣である可能性が浮上し、クラピカが守護霊獣の脅威を認識し始める。",
    "type": "発覚",
    "duration": 6
  },
  {
    "chapter": "第360〜361話",
    "arc": "王位継承戦",
    "day": 1,
    "time": "10:00",
    "location": "ブラックホエール号 第1ティア 1013号室（ワブル王子室）",
    "event": "念講習開始・守護霊獣の寄生型能力判明",
    "participants": ["クラピカ", "ビル", "センリツ", "ハンゾー", "バショウ"],
    "summary": "クラピカ主導の念講習会がスタート。ハンゾーがスキルを即座に習得し場を驚かせる。守護霊獣が護衛対象に寄生する型の念能力であることが複数の王子室で確認される。参加者は守護霊獣の危険性を初めて共有する。",
    "type": "会合",
    "duration": 12
  },
  {
    "chapter": "第361話",
    "arc": "王位継承戦",
    "day": 1,
    "time": null,
    "location": "ブラックホエール号 第1ティア 1013号室",
    "event": "ベンジャミン私設兵・念講習へのスパイ潜入",
    "participants": ["ベンジャミン＝ホイコーロ", "ブフェルギン", "クラピカ"],
    "summary": "ベンジャミンが念能力者私設兵の一人（ブフェルギン）をクラピカの念講習に参加者として潜入させ、参加者の顔・能力・クラピカの指導方針を収集させる。クラピカはスパイの存在を察知しつつも黙認し、逆に守護霊獣に関する情報を意図的に流す逆利用戦略を取る。",
    "type": "発覚",
    "duration": 6
  },
  {
    "chapter": "第362話",
    "arc": "王位継承戦",
    "day": 2,
    "time": null,
    "location": "ブラックホエール号 ツェリードニヒ王子室",
    "event": "ツェリードニヒの念習得開始・守護霊獣の外見初描写",
    "participants": ["ツェリードニヒ＝ホイコーロ", "テータ"],
    "summary": "守護霊獣の全王子への配備が確認される。ツェリードニヒが念能力の習得に着手。侍女テータが念の教師としてツェリードニヒと向き合う決意を固める。各王子の守護霊獣の外見が詳細に描写され、それぞれの能力系統が少しずつ明らかになる。",
    "type": "発覚",
    "duration": 5
  },
  {
    "chapter": "第363〜365話",
    "arc": "王位継承戦",
    "day": 2,
    "time": null,
    "location": "ブラックホエール号 各デッキ",
    "event": "チョウライ守護霊獣によるコイン配布工作",
    "participants": ["チョウライ＝ホイコーロ", "チョウライ陣営工作員"],
    "summary": "チョウライの守護霊獣が毎日産み出すコインを船内の有力者・念能力者に戦略的に配布する工作が展開される。コインの所持者に念現象が発現するチョウライの謀略で、知らぬ間に多くの人物がチョウライ陣営に取り込まれる人材収集網が始動する。",
    "type": "会合",
    "duration": 5
  },
  {
    "chapter": "第364〜366話",
    "arc": "王位継承戦",
    "day": 3,
    "time": null,
    "location": "ブラックホエール号 サレサレ王子室",
    "event": "サレサレ暗殺（継承戦最初の脱落）",
    "participants": ["サレサレ＝ホイコーロ", "ベンジャミン＝ホイコーロ", "ベンジャミン私設兵"],
    "summary": "第8王子サレサレがベンジャミンの私設兵により暗殺される。継承戦の最初の脱落者となる。ベンジャミンは「ベンジャミンバトン（星を継ぐもの）」によりサレサレの護衛が持っていた念能力を自身の能力として継承する。",
    "type": "暗殺",
    "duration": 4
  },
  {
    "chapter": "第366〜367話",
    "arc": "王位継承戦",
    "day": 3,
    "time": null,
    "location": "ブラックホエール号 タイソン王子室周辺",
    "event": "タイソン教典配布・守護霊獣（目玉ジャクシ）の寄生開始",
    "participants": ["タイソン＝ホイコーロ", "タイソン信者"],
    "summary": "タイソンが船内で「タイソン教典」の配布活動を本格化させる。教典を受け取った者に守護霊獣の念獣（目玉ジャクシ群）が宿り、幸福感を与えながらオーラを継続的に吸収し始める。気づかない被害者が拡大し、タイソンの宗教的影響力が船内に浸透していく。",
    "type": "会合",
    "duration": 6
  },
  {
    "chapter": "第367話前後",
    "arc": "王位継承戦",
    "day": 3,
    "time": null,
    "location": "ブラックホエール号 カミーラ王子室",
    "event": "ベンジャミン私設兵がカミーラ暗殺試行・「100万回生きた猫」発動",
    "participants": ["カミーラ＝ホイコーロ", "ベンジャミン私設兵"],
    "summary": "ベンジャミンの私設兵がカミーラの暗殺を試み一度成功するが、死後強まる念「100万回生きた猫（ネコノナマエ）」が発動。カミーラを殺した私設兵は「道連れ」として吸収されカミーラが蘇生する。ベンジャミン陣営に大きな損害が出てカミーラへの直接暗殺は事実上断念せざるを得なくなる。",
    "type": "戦闘",
    "duration": 5
  },
  {
    "chapter": "第368〜370話",
    "arc": "王位継承戦",
    "day": 4,
    "time": null,
    "location": "ブラックホエール号 モモゼ王子室",
    "event": "モモゼ暗殺・タフディー事件",
    "participants": ["モモゼ＝ホイコーロ", "タフディー", "ハンゾー", "セヴァンチ＝ホイコーロ"],
    "summary": "第7王妃セヴァンチがハンゾーとビスケをモモゼから引き離し護衛を弱体化させた隙に、護衛タフディーがモモゼを暗殺（絞殺）する。直後にハンゾーがタフディーを殺害。モモゼが2人目の脱落者となる。セヴァンチが自分の子モモゼよりマラヤームを優先した疑惑が浮上する。",
    "type": "暗殺",
    "duration": 5
  },
  {
    "chapter": "第372話",
    "arc": "王位継承戦",
    "day": 5,
    "time": null,
    "location": "ブラックホエール号 第13王子室周辺",
    "event": "マラヤーム守護霊獣の変貌・念空間形成",
    "participants": ["マラヤーム＝ホイコーロ", "セヴァンチ＝ホイコーロ"],
    "summary": "モモゼの死によりマラヤームの守護霊獣が急激に変貌・巨大化し念空間を形成して外界から遮断する。優雅な龍型から凶暴な巨大恐竜型へと姿を変え、マラヤームが事実上の籠城状態に入る。マラヤームの精神状態（恐怖・ストレス）が念獣の形状に直接影響していることが明らかになる。",
    "type": "発覚",
    "duration": 6
  },
  {
    "chapter": "第371〜374話",
    "arc": "王位継承戦",
    "day": 5,
    "time": null,
    "location": "ブラックホエール号 第9王子室",
    "event": "ハルケンブルグ・私設兵全員への羽の刻印付与・クーデター準備完了",
    "participants": ["ハルケンブルグ＝ホイコーロ", "ハルケンブルグ私設兵全員"],
    "summary": "ハルケンブルグが配下の私設兵全員に守護霊獣の「羽の刻印」を与える儀式を完了する。刻印保持者が集結することで守護霊獣の力が大幅に増強される集合型念の準備が整う。継承戦廃止と父王ナスビーへの直接交渉を目的としたクーデターの実行準備が完了する。",
    "type": "会合",
    "duration": 7
  },
  {
    "chapter": "第373〜374話",
    "arc": "王位継承戦",
    "day": 5,
    "time": null,
    "location": "ブラックホエール号 カチョウ王子室",
    "event": "センリツがカチョウの逃走計画に協力・脱出計画策定",
    "participants": ["カチョウ＝ホイコーロ", "フウゲツ＝ホイコーロ", "センリツ（旋律）"],
    "summary": "センリツがカチョウとフウゲツの双子王子の本心（継承戦への絶望と恐怖）を心音で読み取る。カチョウがセンリツに正直に逃走計画を打ち明け協力を要請。守護霊獣「秘密の扉（マジカルワーム）」を使った下層デッキへの脱出計画が秘密裏に策定される。",
    "type": "会合",
    "duration": 8
  },
  {
    "chapter": "第372話前後",
    "arc": "王位継承戦",
    "day": 5,
    "time": null,
    "location": "ブラックホエール号 ルズールス王子室周辺",
    "event": "ルズールス守護霊獣の「欲望の罠」・被害者捕捉",
    "participants": ["ルズールス＝ホイコーロ", "罠に引っかかった人物"],
    "summary": "ルズールスの守護霊獣が船内各所に設置していた「標的の欲望を具現化した罠」に何者かが引っかかったことが判明する。罠にかかった者は知らぬ間にルズールスの念獣の操作下に置かれる。ルズールスが積極的に動かずとも知らぬ間に影響力を拡大していることが浮上する。",
    "type": "発覚",
    "duration": 4
  },
  {
    "chapter": "第375〜377話",
    "arc": "王位継承戦",
    "day": 6,
    "time": null,
    "location": "ブラックホエール号 第10・第11王子室周辺",
    "event": "カチョウ死亡・フウゲツの下層デッキへの脱出成功",
    "participants": ["カチョウ＝ホイコーロ", "フウゲツ＝ホイコーロ", "センリツ（旋律）"],
    "summary": "カチョウとフウゲツが継承戦からの離脱を試みる。カチョウが死亡するが「2人セゾン（キミガイナイ）」が発動しカチョウの姿をした念獣がフウゲツを守護し続ける。フウゲツは「秘密の扉（マジカルワーム）」で下層デッキへの脱出に成功。継承戦から事実上離脱した唯一の王子となる。",
    "type": "暗殺",
    "duration": 7
  },
  {
    "chapter": "第379〜382話",
    "arc": "王位継承戦",
    "day": 8,
    "time": null,
    "location": "ブラックホエール号 第1ティア全体・ナスビー王室",
    "event": "ハルケンブルグのクーデター・失敗・意識がナスビーに憑依",
    "participants": ["ハルケンブルグ＝ホイコーロ", "ナスビー＝ホイコーロ", "ハルケンブルグ私設兵全員", "ミザイストム"],
    "summary": "ハルケンブルグが継承戦廃止を目的とした父王ナスビーへのクーデターを試みる。羽の刻印を持つ私設兵が一斉蜂起し集合型念で攻撃するが計画は失敗。ハルケンブルグの肉体は死亡するが意識（念）がナスビー国王に憑依するという予期せぬ結末となる。",
    "type": "戦闘",
    "duration": 10
  },
  {
    "chapter": "第380話",
    "arc": "王位継承戦",
    "day": 9,
    "time": null,
    "location": "ブラックホエール号 下層デッキ・十二支ん区画",
    "event": "フウゲツ発見・幻影旅団乗船発覚",
    "participants": ["フウゲツ＝ホイコーロ", "ミザイストム", "イルミ＝ゾルディック", "カルト＝ゾルディック"],
    "summary": "下層デッキに脱出していたフウゲツが発見・保護される。ミザイストムが第3ティアで連続殺人事件が多発していることを把握し警告を発する。イルミとカルトに接触し幻影旅団が船内に乗り込んでいることが判明する。",
    "type": "発覚",
    "duration": 6
  },
  {
    "chapter": "第381〜383話",
    "arc": "王位継承戦",
    "day": 10,
    "time": null,
    "location": "ブラックホエール号 下層デッキ 十二支ん区画",
    "event": "ゾルディック家（イルミ・カルト）の目的と行動発覚",
    "participants": ["ミザイストム", "イルミ＝ゾルディック", "カルト＝ゾルディック"],
    "summary": "イルミ＝ゾルディックがヒソカの抹殺を目的として独自行動していることが判明。カルト＝ゾルディックはゴンへの強い執着を持ち暗黒大陸航行に乗じている。十二支んが直接介入できない複雑な力関係が生まれ、船内の権力構造がさらに混沌とする。",
    "type": "発覚",
    "duration": 6
  },
  {
    "chapter": "第385〜390話",
    "arc": "王位継承戦",
    "day": 11,
    "time": null,
    "location": "ブラックホエール号 ツェリードニヒ王子室",
    "event": "ツェリードニヒの特質系能力複数開花・天才性が確定",
    "participants": ["ツェリードニヒ＝ホイコーロ", "テータ", "クラピカ"],
    "summary": "ツェリードニヒが「刹那の10秒（テン・セカンズ）」に加え新たな特質系能力を複数習得する。わずか数週間での複数能力開花という前代未聞の速度はクラピカをも脅かす。ツェリードニヒが継承戦において最も危険な王子であることが確定的になる。",
    "type": "発覚",
    "duration": 8
  },
  {
    "chapter": "第388〜392話",
    "arc": "王位継承戦",
    "day": 12,
    "time": null,
    "location": "ブラックホエール号 ツェリードニヒ王子室",
    "event": "ツェリードニヒ守護霊獣「嘘つきを道具に変える」制裁が実際に発動",
    "participants": ["ツェリードニヒ＝ホイコーロ", "ズバダ", "テータ"],
    "summary": "ツェリードニヒの守護霊獣「人面馬」の恐るべき制裁能力が実際に発動する。ツェリードニヒに嘘をついた護衛が「道具（モノ）」へと変化するという残酷な現実が起きる。テータをはじめとする周辺者が戦慄し、ツェリードニヒの恐怖政治体制が護衛内部に確立する。",
    "type": "発覚",
    "duration": 7
  },
  {
    "chapter": "第400話前後",
    "arc": "王位継承戦",
    "day": 14,
    "time": null,
    "location": "ブラックホエール号 ツベッパ王子室・ワブル王子室",
    "event": "クラピカ＝ツベッパ和平協定締結",
    "participants": ["クラピカ", "ツベッパ＝ホイコーロ", "オイト＝ホイコーロ"],
    "summary": "ツベッパがクラピカ（ワブル陣営）との和平協定を正式に締結。情報共有・相互不可侵・共同生活も視野に入れた実利的同盟が成立する。上位王子（第5位）と最弱位置（第14位）の明確な同盟として継承戦の構図を大きく変える。クラピカはツェリードニヒ対策の時間的余裕を獲得する。",
    "type": "会合",
    "duration": 9
  },
  {
    "chapter": "第395〜402話",
    "arc": "王位継承戦",
    "day": 15,
    "time": null,
    "location": "ブラックホエール号 下層デッキ全域",
    "event": "幻影旅団・カキンマフィア・王子陣営の三つ巴衝突",
    "participants": ["フランクリン", "ヒソカ", "幻影旅団各メンバー", "カキンマフィア各勢力", "ベンジャミン私設兵"],
    "summary": "下層デッキで幻影旅団とカキンマフィアの衝突が激化する。ヒソカとフランクリンが別行動を取りながら船内で暴れ回る。上層の継承戦と下層のギャング抗争が複合的に絡み合い船全体が極度の緊張状態に入る。マフィア複数組織の思惑が交錯し秩序が崩壊寸前となる。",
    "type": "戦闘",
    "duration": 15
  }
]
